{
  "task_id": "task-6",
  "task_name": "Resolver promotes declared conditional references",
  "task_type": "service_api",
  "status": "success",
  "files_created": [
    "src/gdskills/reference-entries.ts"
  ],
  "files_modified": [
    "src/gdskills/context-resolver.ts",
    "src/gdskills/context-resolver.test.ts",
    "src/gdskills/resolve-context-command.ts",
    "src/commands/skills.ts",
    "src/harness/tool/metaproject-operations.ts",
    "src/harness/tool/metaproject-operations.test.ts",
    "src/harness/tool/metaproject-adapter.ts",
    "src/harness/tool/metaproject-port.ts",
    "src/mcp/metaproject-tools.ts"
  ],
  "project_context_applied": [
    { "path": ".metaproject/rules/core/tdd-workflow.mdc", "sha256": "3d43be89e4fcf4e6e297073047df83077104566a9c7d836e14c19d3ace7e08f3", "how": "followed" },
    { "path": ".metaproject/rules/core/error-handling.mdc", "sha256": "78292e60e0951780a20ae370fc4f41236f20f77879b5e9eab09e2b735fa32f0c", "how": "followed" },
    { "path": ".metaproject/rules/core/solid-principles.mdc", "sha256": "ef5fa709b48455929607b9e5b23ec0ed5eaa7708c17fb9d59b43b8108ed8f43b", "how": "read" },
    { "path": ".metaproject/rules/core/code-style-patterns.mdc", "sha256": "669e9c94af9ec97a109a92659fa5197aee688792972d95ec1fae8a3beb89de2e", "how": "read" },
    { "path": ".metaproject/rules/core/nestjs-dto.mdc", "sha256": "cc7f279aad31f3df6bb157bf30af8150ac60c2f9846973baeef036be37394051", "how": "n/a" },
    { "path": ".metaproject/rules/core/api-contracts.mdc", "sha256": "f124ab1a3f31af1a67e0620f9e750c1f111a1b94bd8e48f58139c53e1919551a", "how": "read" }
  ]
}
